{
  "kind": "template",
  "project": "eternal-moment-studio",
  "template": {
    "title": "Native Test Header",
    "type": "header",
    "status": "publish"
  },
  "design": {
    "route": "editorial-premium",
    "colors": {
      "primary": "#6F5A47",
      "secondary": "#C9A46A",
      "accent": "#8C6F5A",
      "dark": "#171310",
      "light": "#F6F1EA",
      "white": "#FFFFFF",
      "muted": "#6F6760"
    },
    "fonts": {
      "heading": "Playfair Display",
      "body": "Inter"
    }
  },
  "sections": [
    {
      "component": "HeaderNavMenu",
      "content": {
        "brand": "Eternal Moment",
        "homeUrl": "/?page_id=12",
        "menu": "{{menu:primary}}",
        "breakpoint": "tablet"
      }
    }
  ]
}
